{
  "$schema": "https://kubb.dev/schemas/registry-record.json",
  "id": "kubb-labs/plugin-react-query",
  "artifact": {
    "kind": "npm",
    "package": "@kubb/plugin-react-query",
    "version": "5.8.0"
  },
  "repository": {
    "url": "https://github.com/kubb-labs/plugins/tree/main/packages/plugin-react-query"
  },
  "submittedAt": "2026-10-12T20:11:53Z",
  "submittedBy": "stijnvanhulle",
  "publishedAt": "2026-10-12T20:11:53Z",
  "reviewedAt": "2026-10-29T15:08:24Z",
  "categories": [
    "framework"
  ]
}
