{
  "$schema": "https://kubb.dev/schemas/registry-record.json",
  "id": "kubb-labs/parser-ts",
  "artifact": {
    "kind": "npm",
    "package": "@kubb/parser-ts",
    "version": "5.15.2"
  },
  "repository": {
    "url": "https://github.com/kubb-labs/kubb/tree/main/packages/parser-ts"
  },
  "submittedAt": "2026-10-12T20:11:53Z",
  "submittedBy": "stijnvanhulle",
  "publishedAt": "2026-10-12T20:11:53Z",
  "reviewedAt": "2026-10-29T15:08:24Z",
  "categories": [
    "typescript"
  ]
}
