{
  "$schema": "https://kubb.dev/schemas/registry-record.json",
  "id": "kubb-labs/plugin-swr",
  "artifact": {
    "kind": "npm",
    "package": "@kubb/plugin-swr",
    "version": "5.4.3"
  },
  "repository": {
    "url": "https://github.com/kubb-labs/plugins/tree/main/packages/plugin-swr"
  },
  "submittedAt": "2026-10-12T20:11:53Z",
  "submittedBy": "stijnvanhulle",
  "publishedAt": "2026-10-12T20:11:53Z",
  "reviewedAt": "2026-10-19T13:14:31Z",
  "categories": [
    "framework"
  ]
}
