{
  "$schema": "https://kubb.dev/schemas/registry-record.json",
  "id": "kubb-labs/plugin-faker",
  "artifact": {
    "kind": "npm",
    "package": "@kubb/plugin-faker",
    "version": "5.1.9"
  },
  "repository": {
    "url": "https://github.com/kubb-labs/plugins/tree/main/packages/plugin-faker"
  },
  "submittedAt": "2026-10-12T20:11:53Z",
  "submittedBy": "stijnvanhulle",
  "publishedAt": "2026-10-12T20:11:53Z",
  "reviewedAt": "2026-10-19T13:14:31Z",
  "categories": [
    "mocks"
  ]
}
