{
  "$schema": "https://kubb.dev/schemas/registry-record.json",
  "id": "kubb-labs/plugin-cypress",
  "artifact": {
    "kind": "npm",
    "package": "@kubb/plugin-cypress",
    "version": "5.0.6"
  },
  "repository": {
    "url": "https://github.com/kubb-labs/plugins/tree/main/packages/plugin-cypress"
  },
  "submittedAt": "2026-10-12T20:11:53Z",
  "submittedBy": "stijnvanhulle",
  "publishedAt": "2026-10-12T20:11:53Z",
  "reviewedAt": "2026-10-12T20:11:53Z",
  "categories": [
    "testing"
  ]
}
