{
  "$schema": "https://kubb.dev/schemas/registry-record.json",
  "id": "kubb-labs/plugin-redoc",
  "artifact": {
    "kind": "npm",
    "package": "@kubb/plugin-redoc",
    "version": "5.0.4"
  },
  "repository": {
    "url": "https://github.com/kubb-labs/plugins/tree/main/packages/plugin-redoc"
  },
  "submittedAt": "2026-10-12T20:11:53Z",
  "submittedBy": "stijnvanhulle",
  "publishedAt": "2026-10-12T20:11:53Z",
  "reviewedAt": "2026-10-12T20:11:53Z",
  "categories": ["documentation"]
}
